{
  "format": "uasek.project-context",
  "format_version": 1,
  "exported_at": "2026-10-21T14:38:19+00:00",
  "state": {
    "schema_version": 1,
    "project": {
      "name": "UNIVERSAL AI SOFTWARE ENGINEERING KIT",
      "description": "Infraestructura local portable de coordinación y continuidad de ingeniería asistida por IA.",
      "objectives": [],
      "functional_requirements": [],
      "non_functional_requirements": []
    },
    "architecture": "CLI modular Python; archivos JSON/Markdown; operaciones locales; HTTP explícito OSV/registros/Ollama.",
    "stack": [
      {
        "technology": "Python",
        "minimum": "3.11",
        "tested": "3.12.10",
        "source": "https://devguide.python.org/versions/",
        "checked_at": "2026-10-21"
      },
      {
        "technology": "runtime dependencies",
        "version": "stdlib only"
      }
    ],
    "decisions": [
      "Núcleo sin dependencias externas de ejecución.",
      "Transferencia manual para proveedores cloud; solo Ollama tiene adaptador HTTP nativo.",
      "Contratos de agentes persistentes; ejecución y revisión por asistente/persona autorizada.",
      "Plantillas sectoriales son documentación adaptable, no aplicaciones completas.",
      "Contexto universal v1 separado de configuración e instrucciones de proveedores.",
      "Checkpoints verificables; recuperar siempre en carpeta nueva sin sobrescribir el proyecto.",
      "Orquestación por reglas explicables, presupuesto de roles y tareas secuenciales idempotentes.",
      "Entrega Git en https://github.com/jylmdev-cyber/pallaquino-team.git, rama main; autor y committer Jimmy Lingan <jylmdev@gmail.com>."
    ],
    "tasks": [
      {
        "id": "T0001",
        "title": "Implementar núcleo operativo",
        "agent": "tech-lead",
        "acceptance": "CLI, memoria y operaciones con pruebas",
        "depends_on": [],
        "status": "done",
        "evidence": [
          "uasek/cli.py",
          "tests/test_core.py"
        ],
        "created_at": "2026-10-21T13:56:05+00:00",
        "updated_at": "2026-10-21T13:56:05+00:00"
      },
      {
        "id": "T0002",
        "title": "Entregar agentes, skills y referencias",
        "agent": "solution-architect",
        "acceptance": "21 contratos, 31 skills y 30 sistemas enlazados",
        "depends_on": [
          "T0001"
        ],
        "status": "done",
        "evidence": [
          "configs/agents.json",
          "configs/catalog.json",
          "docs/quality/evidence/skills.json"
        ],
        "created_at": "2026-10-21T13:56:05+00:00",
        "updated_at": "2026-10-21T13:56:05+00:00"
      },
      {
        "id": "T0003",
        "title": "Validar instalación y distribución",
        "agent": "qa-engineer",
        "acceptance": "Suite, wheel aislado y ZIP extraído comprobados",
        "depends_on": [
          "T0002"
        ],
        "status": "done",
        "evidence": [
          "docs/quality/VALIDATION_REPORT.md",
          "docs/quality/evidence/tests.json",
          "docs/quality/evidence/extracted-zip.json"
        ],
        "created_at": "2026-10-21T13:56:05+00:00",
        "updated_at": "2026-10-21T13:56:05+00:00"
      },
      {
        "id": "T0004",
        "title": "Contexto universal, checkpoints y orquestación adaptable",
        "agent": "tech-lead",
        "acceptance": "Round-trip neutral, recuperación íntegra y planes sin duplicación, con pruebas en wheel y ZIP.",
        "depends_on": [],
        "status": "done",
        "evidence": [
          "tests/test_continuity.py",
          "docs/quality/evidence/tests-1.1.0.json",
          "docs/quality/evidence/installed-wheel-1.1.0.json"
        ],
        "created_at": "2026-10-21T14:15:29+00:00",
        "updated_at": "2026-10-21T14:15:29+00:00"
      }
    ],
    "known_issues": [
      "La prueba de symlink puede omitirse en Windows sin privilegios.",
      "Modelos reales y CI Linux/macOS no ejecutados.",
      "El proyecto no tiene repositorio Git; la auditoría autorizada no pudo ejecutarse."
    ],
    "technical_debt": [
      "Runners distintos a unittest usan ejecución externa.",
      "Locks de dependencias adicionales aún no implementados.",
      "La escritura conjunta de JSON y vistas Markdown no es una transacción."
    ],
    "audits": [
      {
        "scope": "Repositorio del usuario",
        "status": "no_ejecutada",
        "reason": "Carpeta inicialmente vacía; ninguna auditoría solicitada."
      },
      {
        "at": "2026-10-21T14:15:06+00:00",
        "authorized": true,
        "scope": "full",
        "status": "not_a_git_repository"
      }
    ],
    "history": [
      "2026-10-21T13:56:05+00:00 creada T0001",
      "2026-10-21T13:56:05+00:00 T0001: done",
      "2026-10-21T13:56:05+00:00 creada T0002",
      "2026-10-21T13:56:05+00:00 T0002: done",
      "2026-10-21T13:56:05+00:00 creada T0003",
      "2026-10-21T13:56:05+00:00 T0003: done",
      "2026-10-21T14:15:29+00:00 creada T0004",
      "2026-10-21T14:15:29+00:00 T0004: done",
      "2026-10-21T14:38:19+00:00 publicación inicial Git preparada por solicitud explícita del propietario."
    ],
    "next_actions": [
      "Ejecutar doctor y pruebas en el entorno receptor.",
      "Usar orchestrate para seleccionar roles; crear checkpoint antes de cambios importantes.",
      "Exportar PROJECT_CONTEXT.json y revisar evidencias al cambiar de asistente."
    ],
    "last_task": "T0004",
    "files_involved": [
      "tests/test_continuity.py",
      "docs/quality/evidence/tests-1.1.0.json",
      "docs/quality/evidence/installed-wheel-1.1.0.json"
    ],
    "validated_checkpoint": "CP-20261021T141530203859Z-823bf07c",
    "updated_at": "2026-10-21T14:38:19+00:00"
  },
  "state_sha256": "7d5f54b89ac735d1396332c0830859d6c796a27bf17585fb67565b1a4b26eb66"
}
